{
  "schema_version": 1,
  "repository": "zenchron-dynamics/zenchron-foundry",
  "generated_at": "1970-01-01T00:00:00Z",
  "image": {
    "family": "php-cli",
    "selector": "8.4",
    "platform": "linux/amd64"
  },
  "build_inputs": {
    "source_sha": "39b77c000a00c718e10de9a449d3d15a3d51c696",
    "source_date_epoch": 1787497475,
    "context_path": "images/php-cli/8.4",
    "context_digest": "sha256:d16801845ccbea378eab85d8be1d37b49db2f5b7ff9d2bb83f1b8cc7d1a59efd",
    "dockerfile_digest": "sha256:835d9be7b4f359ccd266df732a833bab70a00db491370f570047f926112e66fb",
    "base": {
      "reference": "php:8.4-cli-bookworm@sha256:138a210978c7767ef2a26f499c413fe6de1c13233c9a5068139565c81191b1ac",
      "manifest_digest": "sha256:138a210978c7767ef2a26f499c413fe6de1c13233c9a5068139565c81191b1ac",
      "platform_child_digest": "sha256:3d56210fda6b7d59aafa29e9cca48d1f0d7c140302ffdb90c88a51c95a6c6c33"
    },
    "build_args": {
      "SOURCE_DATE_EPOCH": "1787497475",
      "BUILD_DATE": "2026-08-23T15:04:35Z",
      "VCS_REF": "39b77c000a00c718e10de9a449d3d15a3d51c696"
    },
    "toolchain": {
      "dockerfile_frontend": "docker/dockerfile:1.7",
      "buildx": "v0.33.0-desktop.1",
      "docker_server": "29.4.1"
    }
  },
  "package_resolution": {
    "guaranteed": false,
    "repositories": [
      "Components: main",
      "Suites: bookworm bookworm-updates",
      "Suites: bookworm-security",
      "URIs: http://deb.debian.org/debian",
      "URIs: http://deb.debian.org/debian-security"
    ],
    "snapshot_identity": null,
    "archive_release_dates": [],
    "package_count": 127,
    "package_set_sha256": "76180f75d951863e81209e3ded15300479f8e9d3a0572d2e9b5d68b53fdfe68d",
    "packages": [
      {
        "name": "adduser",
        "version": "3.134",
        "architecture": "all"
      },
      {
        "name": "apt",
        "version": "2.6.1",
        "architecture": "amd64"
      },
      {
        "name": "base-files",
        "version": "12.4+deb12u15",
        "architecture": "amd64"
      },
      {
        "name": "base-passwd",
        "version": "3.6.1",
        "architecture": "amd64"
      },
      {
        "name": "bash",
        "version": "5.2.15-2+b13",
        "architecture": "amd64"
      },
      {
        "name": "bsdutils",
        "version": "1:2.38.1-5+deb12u3",
        "architecture": "amd64"
      },
      {
        "name": "ca-certificates",
        "version": "20250419~deb12u1",
        "architecture": "all"
      },
      {
        "name": "coreutils",
        "version": "9.1-1",
        "architecture": "amd64"
      },
      {
        "name": "curl",
        "version": "7.88.1-10+deb12u15",
        "architecture": "amd64"
      },
      {
        "name": "dash",
        "version": "0.5.12-2",
        "architecture": "amd64"
      },
      {
        "name": "debconf",
        "version": "1.5.82",
        "architecture": "all"
      },
      {
        "name": "debian-archive-keyring",
        "version": "2023.3+deb12u2",
        "architecture": "all"
      },
      {
        "name": "debianutils",
        "version": "5.7-0.5~deb12u1",
        "architecture": "amd64"
      },
      {
        "name": "diffutils",
        "version": "1:3.8-4",
        "architecture": "amd64"
      },
      {
        "name": "dpkg",
        "version": "1.21.23",
        "architecture": "amd64"
      },
      {
        "name": "e2fsprogs",
        "version": "1.47.0-2+b2",
        "architecture": "amd64"
      },
      {
        "name": "file",
        "version": "1:5.44-3",
        "architecture": "amd64"
      },
      {
        "name": "findutils",
        "version": "4.9.0-4",
        "architecture": "amd64"
      },
      {
        "name": "gcc-12-base",
        "version": "12.2.0-14+deb12u1",
        "architecture": "amd64"
      },
      {
        "name": "gpgv",
        "version": "2.2.40-1.1+deb12u2",
        "architecture": "amd64"
      },
      {
        "name": "grep",
        "version": "3.8-5",
        "architecture": "amd64"
      },
      {
        "name": "gzip",
        "version": "1.12-1",
        "architecture": "amd64"
      },
      {
        "name": "hostname",
        "version": "3.23+nmu1",
        "architecture": "amd64"
      },
      {
        "name": "init-system-helpers",
        "version": "1.65.2+deb12u1",
        "architecture": "all"
      },
      {
        "name": "libacl1",
        "version": "2.3.1-3",
        "architecture": "amd64"
      },
      {
        "name": "libapt-pkg6.0",
        "version": "2.6.1",
        "architecture": "amd64"
      },
      {
        "name": "libargon2-1",
        "version": "0~20171227-0.3+deb12u1",
        "architecture": "amd64"
      },
      {
        "name": "libattr1",
        "version": "1:2.5.1-4",
        "architecture": "amd64"
      },
      {
        "name": "libaudit-common",
        "version": "1:3.0.9-1",
        "architecture": "all"
      },
      {
        "name": "libaudit1",
        "version": "1:3.0.9-1",
        "architecture": "amd64"
      },
      {
        "name": "libblkid1",
        "version": "2.38.1-5+deb12u3",
        "architecture": "amd64"
      },
      {
        "name": "libbrotli1",
        "version": "1.0.9-2+b6",
        "architecture": "amd64"
      },
      {
        "name": "libbz2-1.0",
        "version": "1.0.8-5+b1",
        "architecture": "amd64"
      },
      {
        "name": "libc-bin",
        "version": "2.36-9+deb12u14",
        "architecture": "amd64"
      },
      {
        "name": "libc6",
        "version": "2.36-9+deb12u14",
        "architecture": "amd64"
      },
      {
        "name": "libcap-ng0",
        "version": "0.8.3-1+b3",
        "architecture": "amd64"
      },
      {
        "name": "libcap2",
        "version": "1:2.66-4+deb12u3+b1",
        "architecture": "amd64"
      },
      {
        "name": "libcom-err2",
        "version": "1.47.0-2+b2",
        "architecture": "amd64"
      },
      {
        "name": "libcrypt1",
        "version": "1:4.4.33-2",
        "architecture": "amd64"
      },
      {
        "name": "libcurl4",
        "version": "7.88.1-10+deb12u15",
        "architecture": "amd64"
      },
      {
        "name": "libdb5.3",
        "version": "5.3.28+dfsg2-1",
        "architecture": "amd64"
      },
      {
        "name": "libdebconfclient0",
        "version": "0.270",
        "architecture": "amd64"
      },
      {
        "name": "libext2fs2",
        "version": "1.47.0-2+b2",
        "architecture": "amd64"
      },
      {
        "name": "libffi8",
        "version": "3.4.4-1",
        "architecture": "amd64"
      },
      {
        "name": "libfreetype6",
        "version": "2.12.1+dfsg-5+deb12u4",
        "architecture": "amd64"
      },
      {
        "name": "libgcc-s1",
        "version": "12.2.0-14+deb12u1",
        "architecture": "amd64"
      },
      {
        "name": "libgcrypt20",
        "version": "1.10.1-3+deb12u1",
        "architecture": "amd64"
      },
      {
        "name": "libgmp10",
        "version": "2:6.2.1+dfsg1-1.1",
        "architecture": "amd64"
      },
      {
        "name": "libgnutls30",
        "version": "3.7.9-2+deb12u7",
        "architecture": "amd64"
      },
      {
        "name": "libgpg-error0",
        "version": "1.46-1",
        "architecture": "amd64"
      },
      {
        "name": "libgssapi-krb5-2",
        "version": "1.20.1-2+deb12u5",
        "architecture": "amd64"
      },
      {
        "name": "libhogweed6",
        "version": "3.8.1-2",
        "architecture": "amd64"
      },
      {
        "name": "libicu72",
        "version": "72.1-3+deb12u1",
        "architecture": "amd64"
      },
      {
        "name": "libidn2-0",
        "version": "2.3.3-1+b1",
        "architecture": "amd64"
      },
      {
        "name": "libjpeg62-turbo",
        "version": "1:2.1.5-2",
        "architecture": "amd64"
      },
      {
        "name": "libk5crypto3",
        "version": "1.20.1-2+deb12u5",
        "architecture": "amd64"
      },
      {
        "name": "libkeyutils1",
        "version": "1.6.3-2",
        "architecture": "amd64"
      },
      {
        "name": "libkrb5-3",
        "version": "1.20.1-2+deb12u5",
        "architecture": "amd64"
      },
      {
        "name": "libkrb5support0",
        "version": "1.20.1-2+deb12u5",
        "architecture": "amd64"
      },
      {
        "name": "libldap-2.5-0",
        "version": "2.5.13+dfsg-5",
        "architecture": "amd64"
      },
      {
        "name": "liblz4-1",
        "version": "1.9.4-1",
        "architecture": "amd64"
      },
      {
        "name": "liblzma5",
        "version": "5.4.1-1+deb12u1",
        "architecture": "amd64"
      },
      {
        "name": "libmagic-mgc",
        "version": "1:5.44-3",
        "architecture": "amd64"
      },
      {
        "name": "libmagic1",
        "version": "1:5.44-3",
        "architecture": "amd64"
      },
      {
        "name": "libmd0",
        "version": "1.0.4-2",
        "architecture": "amd64"
      },
      {
        "name": "libmount1",
        "version": "2.38.1-5+deb12u3",
        "architecture": "amd64"
      },
      {
        "name": "libnettle8",
        "version": "3.8.1-2",
        "architecture": "amd64"
      },
      {
        "name": "libnghttp2-14",
        "version": "1.52.0-1+deb12u3",
        "architecture": "amd64"
      },
      {
        "name": "libonig5",
        "version": "6.9.8-1",
        "architecture": "amd64"
      },
      {
        "name": "libp11-kit0",
        "version": "0.24.1-2",
        "architecture": "amd64"
      },
      {
        "name": "libpam-modules",
        "version": "1.5.2-6+deb12u2",
        "architecture": "amd64"
      },
      {
        "name": "libpam-modules-bin",
        "version": "1.5.2-6+deb12u2",
        "architecture": "amd64"
      },
      {
        "name": "libpam-runtime",
        "version": "1.5.2-6+deb12u2",
        "architecture": "all"
      },
      {